{
  "instance_name": "Instance1",
  "depot": {
    "id": 0,
    "x": 0.0,
    "y": 0.0
  },
  "vehicles": 2,
  "capacity": 5,
  "customers": [
    {
      "id": 1,
      "x": -2.0,
      "y": 2.0
    },
    {
      "id": 2,
      "x": -5.0,
      "y": 8.0
    },
    {
      "id": 3,
      "x": 2.0,
      "y": 3.0
    }
  ]
}
